{
  "meta": {
    "task_id": "20260209T073953Z_compute_demo",
    "job_name": "compute_20260209T073953Z_compute_demo",
    "backend": "python",
    "backend_available": true,
    "status": "ok",
    "runner": "AGENTS/runtime/compute_runner.py",
    "started_at_utc": "2026-02-09T07:39:53Z",
    "finished_at_utc": "2026-02-09T07:39:54Z",
    "duration_seconds": 0.057025,
    "versions": {
      "python": "Python 3.12.3",
      "wolframscript": "unavailable"
    },
    "commands": [
      "python3 /Users/zhaoyub/Desktop/PHYSICS/AgenticWorkflow/AGENTS/tasks/20260209T073953Z_compute_demo/work/compute/main.py"
    ]
  },
  "inputs": [
    {
      "path": "/Users/zhaoyub/Desktop/PHYSICS/AgenticWorkflow/AGENTS/tasks/20260209T073953Z_compute_demo/request.md",
      "exists": true,
      "bytes": 86,
      "sha256": "0006b6a3133173397e98ea2d6788fb8e0f90298b18eeb6089bd8931c8cf4a551",
      "name": "task_request"
    }
  ],
  "params": {
    "a": 2.0,
    "b": 1.0,
    "sample_points": [
      0,
      1,
      2,
      3,
      4
    ],
    "uncertainty_sigma": 0.05
  },
  "results": {
    "y": [
      1.0,
      3.0,
      5.0,
      7.0,
      9.0
    ],
    "mean_y": 5.0
  },
  "uncertainty": {
    "method": "parameter",
    "sigma": 0.05
  },
  "sanity_checks": [
    {
      "name": "result_vector_length_matches_input",
      "passed": true
    },
    {
      "name": "result_values_are_finite",
      "passed": true
    },
    {
      "name": "mean_value_within_expected_range",
      "passed": true
    }
  ]
}